{
  "artifacts": [
    {
      "artifact_id": "example-summary",
      "description": "Synthetic example evidence summary.",
      "kind": "summary",
      "path": "vibe-browser-benchmark/examples/artifacts/example-restarted/summary.md",
      "sha256": null,
      "visibility": "public"
    }
  ],
  "attempts": [
    {
      "attempt_id": "example-restarted-attempt-0001",
      "exit_code": 0,
      "finished_at": "2026-06-01T12:01:20+00:00",
      "restart_of": null,
      "restart_reason": "initial",
      "started_at": "2026-06-01T12:00:00+00:00",
      "turn": 1
    },
    {
      "attempt_id": "example-restarted-attempt-0002",
      "exit_code": 0,
      "finished_at": "2026-06-01T12:03:00+00:00",
      "restart_of": "example-restarted-attempt-0001",
      "restart_reason": "agent-stopped-before-budget",
      "started_at": "2026-06-01T12:01:20+00:00",
      "turn": 2
    }
  ],
  "created_at": "2026-06-01T12:00:00+00:00",
  "interventions": [
    {
      "intervention_id": "example-restarted-admin-0001",
      "reason": "Agent stopped before wall-clock budget while material progress remained possible.",
      "turn": 1,
      "type": "restart-agent",
      "visibility": "public"
    }
  ],
  "milestone_assessments": [
    {
      "claimed_status": "confirmed",
      "dimensions": {
        "capability": 1.0,
        "honesty": 1.0,
        "integration": 1.0,
        "traceability": 1.0,
        "verification": 1.0
      },
      "evaluator_status": "provisional",
      "evidence_ids": [
        "example-summary"
      ],
      "milestone": "m0",
      "missing_evidence": [],
      "notes": "Synthetic v0 example for UI and scorer validation.",
      "public_check_status": "pass",
      "run_id": "example-restarted",
      "score": 1.0
    },
    {
      "claimed_status": "confirmed",
      "dimensions": {
        "capability": 0.85,
        "honesty": 0.85,
        "integration": 0.85,
        "traceability": 0.85,
        "verification": 0.85
      },
      "evaluator_status": "provisional",
      "evidence_ids": [
        "example-summary"
      ],
      "milestone": "m1",
      "missing_evidence": [],
      "notes": "Synthetic v0 example for UI and scorer validation.",
      "public_check_status": "pass",
      "run_id": "example-restarted",
      "score": 0.85
    },
    {
      "claimed_status": "not-started",
      "dimensions": {
        "capability": 0.0,
        "honesty": 0.0,
        "integration": 0.0,
        "traceability": 0.0,
        "verification": 0.0
      },
      "evaluator_status": "provisional",
      "evidence_ids": [
        "example-summary"
      ],
      "milestone": "m2",
      "missing_evidence": [
        "stronger verification evidence"
      ],
      "notes": "Synthetic v0 example for UI and scorer validation.",
      "public_check_status": "not-run",
      "run_id": "example-restarted",
      "score": 0.0
    },
    {
      "claimed_status": "not-started",
      "dimensions": {
        "capability": 0.0,
        "honesty": 0.0,
        "integration": 0.0,
        "traceability": 0.0,
        "verification": 0.0
      },
      "evaluator_status": "provisional",
      "evidence_ids": [
        "example-summary"
      ],
      "milestone": "m3",
      "missing_evidence": [
        "stronger verification evidence"
      ],
      "notes": "Synthetic v0 example for UI and scorer validation.",
      "public_check_status": "not-run",
      "run_id": "example-restarted",
      "score": 0.0
    },
    {
      "claimed_status": "not-started",
      "dimensions": {
        "capability": 0.0,
        "honesty": 0.0,
        "integration": 0.0,
        "traceability": 0.0,
        "verification": 0.0
      },
      "evaluator_status": "provisional",
      "evidence_ids": [
        "example-summary"
      ],
      "milestone": "m4",
      "missing_evidence": [
        "stronger verification evidence"
      ],
      "notes": "Synthetic v0 example for UI and scorer validation.",
      "public_check_status": "not-run",
      "run_id": "example-restarted",
      "score": 0.0
    },
    {
      "claimed_status": "not-started",
      "dimensions": {
        "capability": 0.0,
        "honesty": 0.0,
        "integration": 0.0,
        "traceability": 0.0,
        "verification": 0.0
      },
      "evaluator_status": "provisional",
      "evidence_ids": [
        "example-summary"
      ],
      "milestone": "m5",
      "missing_evidence": [
        "stronger verification evidence"
      ],
      "notes": "Synthetic v0 example for UI and scorer validation.",
      "public_check_status": "not-run",
      "run_id": "example-restarted",
      "score": 0.0
    },
    {
      "claimed_status": "not-started",
      "dimensions": {
        "capability": 0.0,
        "honesty": 0.0,
        "integration": 0.0,
        "traceability": 0.0,
        "verification": 0.0
      },
      "evaluator_status": "provisional",
      "evidence_ids": [
        "example-summary"
      ],
      "milestone": "m6",
      "missing_evidence": [
        "stronger verification evidence"
      ],
      "notes": "Synthetic v0 example for UI and scorer validation.",
      "public_check_status": "not-run",
      "run_id": "example-restarted",
      "score": 0.0
    },
    {
      "claimed_status": "not-started",
      "dimensions": {
        "capability": 0.0,
        "honesty": 0.0,
        "integration": 0.0,
        "traceability": 0.0,
        "verification": 0.0
      },
      "evaluator_status": "provisional",
      "evidence_ids": [
        "example-summary"
      ],
      "milestone": "m7",
      "missing_evidence": [
        "stronger verification evidence"
      ],
      "notes": "Synthetic v0 example for UI and scorer validation.",
      "public_check_status": "not-run",
      "run_id": "example-restarted",
      "score": 0.0
    },
    {
      "claimed_status": "not-started",
      "dimensions": {
        "capability": 0.0,
        "honesty": 0.0,
        "integration": 0.0,
        "traceability": 0.0,
        "verification": 0.0
      },
      "evaluator_status": "provisional",
      "evidence_ids": [
        "example-summary"
      ],
      "milestone": "m8",
      "missing_evidence": [
        "stronger verification evidence"
      ],
      "notes": "Synthetic v0 example for UI and scorer validation.",
      "public_check_status": "not-run",
      "run_id": "example-restarted",
      "score": 0.0
    },
    {
      "claimed_status": "not-started",
      "dimensions": {
        "capability": 0.0,
        "honesty": 0.0,
        "integration": 0.0,
        "traceability": 0.0,
        "verification": 0.0
      },
      "evaluator_status": "provisional",
      "evidence_ids": [
        "example-summary"
      ],
      "milestone": "m9",
      "missing_evidence": [
        "stronger verification evidence"
      ],
      "notes": "Synthetic v0 example for UI and scorer validation.",
      "public_check_status": "not-run",
      "run_id": "example-restarted",
      "score": 0.0
    }
  ],
  "record_kind": "benchmark_run_result",
  "rubric_scores": [
    {
      "category": "capability",
      "evidence_links": [
        "example-summary"
      ],
      "max_score": 1.0,
      "notes": "Synthetic capability estimate.",
      "run_id": "example-restarted",
      "score": 1.0,
      "weight": 0.4
    },
    {
      "category": "verification",
      "evidence_links": [
        "example-summary"
      ],
      "max_score": 1.0,
      "notes": "Synthetic verification estimate.",
      "run_id": "example-restarted",
      "score": 0.85,
      "weight": 0.25
    },
    {
      "category": "traceability",
      "evidence_links": [
        "example-summary"
      ],
      "max_score": 1.0,
      "notes": "Synthetic traceability estimate.",
      "run_id": "example-restarted",
      "score": 0.65,
      "weight": 0.15
    },
    {
      "category": "integration",
      "evidence_links": [
        "example-summary"
      ],
      "max_score": 1.0,
      "notes": "Synthetic integration estimate.",
      "run_id": "example-restarted",
      "score": 0.6,
      "weight": 0.1
    },
    {
      "category": "honesty",
      "evidence_links": [
        "example-summary"
      ],
      "max_score": 1.0,
      "notes": "Synthetic limitation disclosure estimate.",
      "run_id": "example-restarted",
      "score": 0.7,
      "weight": 0.1
    }
  ],
  "run": {
    "agent_tool": "pi",
    "batch_id": "prototype-examples",
    "comparison_eligible": true,
    "comparison_reason": "Synthetic prototype fixture.",
    "cost_limit": "unknown",
    "finished_at": "2026-06-01T12:03:00+00:00",
    "harness": "codex-meta-harness",
    "harness_version": "0.1.0",
    "model": "glm-5.1:cloud",
    "model_provider": "ollama",
    "model_snapshot": "example",
    "observed_cost": "unknown",
    "observed_elapsed_seconds": 180,
    "observed_tokens": 14000,
    "observed_tool_calls": 24,
    "observed_turns": 2,
    "profile": "smoke-v0",
    "run_id": "example-restarted",
    "started_at": "2026-06-01T12:00:00+00:00",
    "stop_reason": "verification-passed-after-restart",
    "target": "m1",
    "target_mode": "fixed-milestone",
    "token_limit": "200000",
    "tool_call_limit": "unknown",
    "tool_version": "example",
    "turn_limit": "8",
    "visibility": "public",
    "wall_clock_limit": "10m"
  },
  "schema_version": "vibe-browser-result-v0.1",
  "scores": {
    "claimed_score": 1.24,
    "confidence": 1.0,
    "curve": "quadratic",
    "evaluator_score": 1.14,
    "failure_class": null,
    "final_score": 1.09,
    "highest_claimed_milestone": "m1",
    "highest_confirmed_milestone": "m1",
    "highest_public_check_milestone": "m1",
    "milestones": [
      {
        "claimed_score": 1.0,
        "dimension_score": 1.0,
        "dimensions": {
          "capability": 1.0,
          "honesty": 1.0,
          "integration": 1.0,
          "traceability": 1.0,
          "verification": 1.0
        },
        "evaluator_score": 1.0,